mb@mbbookpro14-fedora:~$ lsusb -v -d 10a5:9201

Bus 003 Device 003: ID 10a5:9201 FPC FPC Sensor Controller L:0001 FW:021.26.2.031
Negotiated speed: High Speed (480Mbps)
Device Descriptor:
  bLength                18
  bDescriptorType         1
  bcdUSB               1.10
  bDeviceClass            0 [unknown]
  bDeviceSubClass         0 [unknown]
  bDeviceProtocol         0 
  bMaxPacketSize0        64
  idVendor           0x10a5 FPC
  idProduct          0x9201 FPC Sensor Controller L:0001 FW:021.26.2.031
  bcdDevice            2.31
  iManufacturer           1 FPC
  iProduct                2 FPC Sensor Controller L:0001 FW:021.26.2.031
  iSerial                 0 
  bNumConfigurations      1
  Configuration Descriptor:
    bLength                 9
    bDescriptorType         2
    wTotalLength       0x0019
    bNumInterfaces          1
    bConfigurationValue     1
    iConfiguration          4 FPC Sensor Controller
    bmAttributes         0xa0
      (Bus Powered)
      Remote Wakeup
    MaxPower              100mA
    Interface Descriptor:
      bLength                 9
      bDescriptorType         4
      bInterfaceNumber        0
      bAlternateSetting       0
      bNumEndpoints           1
      bInterfaceClass       255 Vendor Specific Class
      bInterfaceSubClass    255 Vendor Specific Subclass
      bInterfaceProtocol    255 Vendor Specific Protocol
      iInterface              5 FPC Sensor Controller
      Endpoint Descriptor:
        bLength                 7
        bDescriptorType         5
        bEndpointAddress     0x82  EP 2 IN
        bmAttributes            2
          Transfer Type            Bulk
          Synch Type               None
          Usage Type               Data
        wMaxPacketSize     0x0040  1x 64 bytes
        bInterval               0
Device Status:     0x0000
  (Bus Powered)
  
  mb@mbbookpro14-fedora:~$ sudo dmesg | grep -i fpc
[sudo] password for mb: 
[    2.025115] usb 3-5: Product: FPC Sensor Controller L:0001 FW:021.26.2.031
[    2.025116] usb 3-5: Manufacturer: FPC

